input_text,label
"Marijuana smoking linked to peaceful homes, fewer prescription drug overdose deaths ||| I wish marijuana made my house peaceful, if anything it just aggravated situations [SEP] If weed's the problem then keep searching cuz that ain't it.",0
"Steve Harvey is ignorant and close minded ||| As a man, Steve Harvey does not speak for me. [SEP] As a man only Negrodamus speaks for me.",0
"My mom, before and after the 1979 Iranian Islamic Revolution ||| That revolution went counter clockwise. ||| It was hijacked by Islamic extremism, originally started by university students and Marxist protestors [SEP] Because Marxism works out *so* well amirite",0
"SRS is triggered when they find out that a lot of users do not like SJWs as mods. ||| Being a Serb nationalist isn't necessarily an indictment of your ability to moderate a sub, being from SRS is. ||| Very true, but to be fair, Serb nationalist did try to wipe out a race of people.. [SEP] Not a race, damn it, an ethnicity.",0
"Forcillo's wife pleads for his freedom ||| Whatever, they're just afraid he won't be able to get his daily cheeseburger requirement in the clink. ||| I'm sure there will be more than enough of his new roommates who will be happy to put some meat between his buns for him. [SEP] Hahahaha it's real funny to make jokes about rape!",1
"Trevor Humpries banned for 4 years according to his FB page ||| Apparently where he comes from, the standard penalty for rape is no playing card games for four years. [SEP] Long Island may be bad, but come on!",1
Trump adviser compares climate change research to belief Earth is flat ||| Why not dispute gravity and evolution while you're at it? [SEP] Maybe Gravity should dispute him and just *let him go*,0
"Rise of the Tomb Raider is Coming to Windows Store and Steam on January 28th ||| Will the Windows Store version have Xbox achievements? ||| yes ||| And when they shut down the windows store in a few years, you can't play it at all anymore. [SEP] It will be a ""per publisher decision"" whether to port their year old games to a new platform or not so not all hope is lost.",1
"Jediism is not a religion, UK ruling says. ||| Jesus, i read ""judaism"" and tought, wow, here we go. ||| What makes Jediism being ruled ""not a religion"" any better than Judaism? [SEP] One is completely false, and the other one is a cool Jedi school.",1
"Tesla's Cars Will Soon Be Just As Affordable as Gas-Powered Vehicles ||| Here in norway they are already much cheaper than any gas-powered car because of state subsidies. ||| so not cheaper then. [SEP] For the consumer, not the general population and their taxes",0
Microsoft wants you to forget Windows 8 ||| What about my new Windows 8 Phone? [SEP] Does windows 8 phones now have a desktop ui?,1
I can honestly say I am shocked ||| Fuck off with this bullshit. ||| Do you say the same to posts that are racist against blacks? [SEP] Why don't you post it to SRS and summon your other clamhurt legbeards into the fray?,0
"""I am American, and it is beef bourguignon, because we you saved you from the absolute hell of eating schnitzel and sauerkraut as your national dishes."" ||| Funny thing is that France consumes way more Sauerkraut per person anyway than Germany. ||| Even the US consumes more Sauerkraut per capita compared to Germany. [SEP] Well, there are probably more germans in the US than germany!",1
"Mod Rowley about things that give high xp for leveling weapons (like Jellies) ||| How about you do your testing and don't punish us for your mistakes... We have no reference of what we ""should"" be getting ||| This is especially true after a 1.8k% buff [SEP] 18x the exp is all you gotta say",0
Why was there no peace in 1966? ||| We'll just have to go with the pre-pre-pre 67 borders established in Genesis. [SEP] They'd still think of a reason to attack Jews.,0
I've been wearing my leather jacket longer than the cow it came from has ||| Why are you wearing your leather jacket in the shower? [SEP] Also who skins a cow and puts the jacket made from its hide on its corpse?,0
"Clinton pounces on Trump's tax shocker with new ad ||| Waiting for the town hall debate for him to throw the 5 year old mindset.. Trump: her ads are mean and not nice! [SEP] ""She's so mean for making ads of the mean dumb things I've said!""",0
"TIL: NASA was to hide the discovery of extraterrestrial life out of fear of societal collapse. ||| Makes you wonder if they know something and they're not telling us. [SEP] No, we can always trust out government to be 100% transparent and honest with us.",1
"Found someone in line at Target ||| It's as if he's human ||| How dare you speak so ill of our One True God? [SEP] This is reddit, we don't believe in god.",1
"Healing rains from above ||| ""Mom""? ||| Other comics on the Tumblr indicate shipping PharahxMercy with D.Va being their adopted kid. ||| What's with tumblrs obsession with shipping everything and everyone ||| On another note, why do Tumblr kept insisting that everyone is trans? [SEP] Because games need to have trans characters to not be transphobic, and since Blizzard are such horrible people who did not include any, we have to do it for them.",1
"CSGO Competitive Team Matchmaking Concept by H!D FakeNinja ||| This is all good except the ""Pay more to play on better servers"" There's already enough income to cover that and then some. ||| Well, i dont think any cheater would pay to play on 128tick, which basically means you get a win win situation ||| Why not they already paid for the cheat? ||| i have a better idea put don't ban the cheaters just put them in a special rank where they will play against other cheaters lol [SEP] BETTER IDEA Put them in Silver 1 :D",1
"Will Clinton VP Pick Be 'Pronounced Middle Finger' to Millions Who Voted for Bernie? ||| Well you guys shat all over Warren when her name was being floated, what do you expect? [SEP] Yeah, that's *definitely* why Clinton isn't picking a progressive, because leftist tears, not because she wants to shore up corporatist power.",0
Allo Coming Soon? ||| Probably won't come out on Monday because that is a holiday in the US. ||| Chrome was released on Labor Day in 2008! [SEP] Nexus 5 magically appeared on the play store Halloween 2013.,0
"UPS delivers assault rifle instead of child's Christmas gift ||| ""Keyboard size case"", ""assault rifle"", ""ammo clip""... I get the impression the author isn't very familiar with firearms. [SEP] ""HE'S GONNA GO ON A SPREE IN NY WITH THEM ASSAULT CLIPPAZINES""",1
"""Police should only shoot when a gun is pointed at them"" ||| It's painfully obvious these guys have never been in a high stress situation in their entire lives. [SEP] Obviously if you can't handle the stressful situations and you get scared you aren't cut out for the job",1
"How many Golem Skulls are actually in the mines ||| Who cares it doesn't even matter, your better off 5 man pushing one of the 2 lanes instead of getting skulls anyway [SEP] Yeah especially going the opposite lane of your own golem",1
"100 Men Found Gambling Around 10 Tables At Unlicensed Casino, Police Said - West Ridge ||| oh no, heaven forbid we bust this up rather than real problems. ||| if every business operated off the books like this there wouldn't be tax revenue to address any problem [SEP] Oh ya because the government needs more of our money for sure.",1
"Workplace Fire Extinguisher ||| This is okay... Just a seal... ||| I think it breaks quite easily, right? [SEP] Yeah, they really should have used a zip tie.",1
"That was, really great casting. ||| But shouldn't it be a combination of Han and Leia? ||| nah, sometimes genetics just favors one parent. ||| And adds a random big nose. [SEP] It's Plagueis' big nose sense he is technically the Great-Grandfather",1
"What is a common misconception about your main? ||| That she's OP, and should be banned ||| They have a Bayo flair now, just so you know. [SEP] Pretty sure they're talking about zelda",1
"Poll: 86.5% of Israelis oppose cease-fire ||| Have a rocket fired at your house and then ask yourself if you don't mind. ||| Have your land stolen, your home bulldozed, and children murdered, then come back and tell us you don't mind. [SEP] Because Palestine was the first to have that land taken from them and didn't take it from the previous dwellers",1
"'PBS NewsHour' Is Unexciting And Even-Keeled, And People Are Loving It ||| It's almost like real news without the bias is a good thing! [SEP] I think this is just what the big 3 news (cbs, abc, NBC) used to be 20+ years ago.",0
"This transgender woman was arrested for posing as a doctor and injecting cement, mineral oil and flat tire sealant into the buttocks of a woman that wanted a fuller figure, something she did to herself also. ||| Something tells me that fact that the woman was transgender is irrelevant. [SEP] It becomes relevant if you read the article OP posted.",0
"IRS e-mail hearing gets heated over hard drive crash ||| Apparently since trying to get their way with 50+ repeal attempts of the Affordable Care Act, and 14+ inquiries about Benghazi worked so well they're going to try to beat the IRS ""scandal"" like the dead horse it is. [SEP] Yes, we should all save our outrage and criticisms for the next Republican president!",1
What can a person do to make them instantly less attractive? ||| Speak to me in a condescending manner. [SEP] I'm sure you'll be able to cope with it honey.,0
"This is how you advertise. ||| ...did I just see domestic violence used to sell an ab machine? ||| I think he was a thief, not her husband as evidenced by the purse snatching. [SEP] Huh, I thought it was usually women that stole their husbands' money.",1
"Killed for Christ in the Amazon (2017) - in 1956, five American missionaries were speared to death after making contact with a remote Ecuadorian tribe. ||| Wow some pretty toxic comments in here ||| Some users seem almost happy that these people died. [SEP] I am happy because they get to meet their god sooner.",0
"Britain is now the second biggest arms dealer in the world ||| 2nd in the Olympics and now this, we're doing alright for ourselves. ||| Brexit doing wonders. [SEP] AT LEAST WE HAVE OUR COUNTRY BACK",1
"NBA All Star Celebrity Game to be headlined by Drake, Steve Nash, Jose Bautista, Chauncey Billups, Nick Cannon ||| If you're taking a retired basketball player in Nash, a current baseball player in Bautista and a current tennis player in Raonic, you could have probably gotten a big name former hockey player too. [SEP] Just bring back Kessel to Toronto, I'm sure he'd be loved",1
Poll: Bill Clinton Most Admired President of Last 25 Years ||| Say what you want about Clinton but he got stuff done. [SEP] Note that it was with a strongly Republican Congress.,0
"Morbid Inequality: Now Just Six Men Have as Much Wealth as Half the World's Population ||| So, if we take it from them, everbody can have twice as much money [SEP] The poorest 50%, and they would get a few hundred each",0
"YouTube has agreed to stream ""The Interview"" ||| I'm beyond caring about this whole ordeal at this point. ||| I bet this movie sucks. [SEP] it has 9.9 on imdb I bet its real",1
"Cody Garbrandt and TJ Dillashaw to coach TUF 25 ||| It sucks that the fight will be delayed, but seeing TAM vs Elevation is going to make for pretty good television. [SEP] Except for the fact that it will almost surely end with them all making up now, which is kind of lame for me.",0
"Australia Is The Largest Per Capita Contributor Of Foreign Fighters To ISIS ||| Call me racist, but I can pretty much guarantee everyone of them has a heritage from that part of the world and is subscribed to one specific ideology not common amongst most Australians ||| It's really sad that the extreme liberals have ruined our society to the point where we can't even discuss these important issues without being called racist. [SEP] divide and conquer - the politicians modus operandi.",0
"Russia to pick which EU states can export food ||| So who would you guys say are the top 5 most pro-Russia friendly EU countries? ||| Belarus, Hungary, Austria, Germany and Finland maybe? [SEP] So proud of my glorious fatherland ;_;",1
"Trump: We have to start winning wars again ||| Or, you know, we could just not have wars. [SEP] How then, do weapons dealers and defense contractors that pay-to-play rob from the American taxpayer by selling violence to the globe?",0
"Bloodbath in Assam: NDFB(S) kill over 45 in Assam, PM calls it act of cowardice ||| Most importantly, NDFB is funded by Christian evangelists. [SEP] No they must be Islamic, how can terrorists be of any other religions than Islam?",1
"Lawmaker Dismisses Anti-Trans Violence as 'Dudes Walking Around in Dresses Getting Beat Up' ||| Punching trans women: okay Punching actual eugenists and Nazis: no please dont [SEP] The ""alt-right"" gentleman was just exercising his 1st amendment right!",1
"Joey Diaz on racism in MMA and the different types of crowds you see at UFC events ||| He makes a fair point, this is what Woodley is on about [SEP] we're all colorblind, woodley is a race baiter and professional victim, wonderboy was robbed, etc etc",1
Man apparently killed due to carjacking suspects unable to drive manual transmission ||| Aaannnd this is why I conceal carry. ||| And this is why I Canada [SEP] It is impossible to get robbed in Canada amirite?,1
Sanders agrees to participate in Fox News presidential town hall without Clinton ||| I think Bernie Sanders would make a good President. [SEP] THEN DON'T FORGET TO PHONEBANK CANVASSING DONATING YOUR RENT MONEY FOR THIS MONTH TO HIM AND WE CAN MAKE HIM PRESIDENT BUT WE DON'T VOTE SO IT DIDN'T MATTER LOL.,1
"Ron Paul:''Send Iran a 'Thank You' Note For Fighting ISIS'' ||| Should we send Obama a thank you note for bombing ISIS daily? [SEP] Yeah, should we send him a thank you note for funding and arming the terrorists first?",1
"Oceans running out of fish as undeclared catches add a third to official figures ||| And once you deplete natural fish stocks, they take a long, long time to return. [SEP] this is why we better all the rest of them now, before someone else does",0
"It takes one barrel to win a teamfight ||| 20% chance to crit , you crit godbless LOL [SEP] well it actually 50%, either it happens or don't",1
"Dog traumatized by abuse is caressed for the first time ||| That sound is so horrifying, the poor little guy ||| It's a she, her name is Priscilla [SEP] Did you just assume its gender based on its name?",1
"#EuroTerrans ||| Besides the fact that Cloud is a whiner, pro players really should not be using language like that. ||| Does it really matter? [SEP] yes, because if he says those words i will repeat them all day",1
"Hole 4 B.R.P. ||| Flat, stable shot with an Atlas ||| 2* flat stable shots with an Atlas. [SEP] 2*, is that Innova's new plastic?",1
"Australia's broadband policy is a flimsy, cynical House of Cards - the Register ||| It's been 5 years and he still can't name or hint at any future applications requiring speeds faster than streaming 4k. [SEP] Yeah and 640kb of memory is enough for everyone!",0
Rotherham council cabinet to resign after damning child exploitation report ||| And the criminal charges are coming when again? [SEP] And yeah you forgot the deport part too!,0
"California grants Tesla $34.7 million tax break to boost production ||| If this was GM getting the tax break Reddit would flip a nut. [SEP] Because reddit is one person, and vote counts are a reliable measure.",1
What is the weirdest reason someone gave you for breaking up with you? ||| I saw Lord of the Rings: Return of the King before he did. [SEP] There's a special place in hell for people like you,1
What smell reminds you of the Airforce? ||| Black mold. ||| Ayyyyyy solid Al Udeid reference. [SEP] Don't you mean an undisclosed location in Central Asia,1
Uhhhmmm.. I think the World Cup app is a little off. ||| With scores like 25-6 it seems like a real football game. [SEP] Yeah the game based around kicking with your feet isn't the real football,1
Live Stream: Obama and Trump meeting at White House ||| If Obama doesnt bow down like he did for the King of Saudi Arabia he is a straight up bitch. [SEP] I think this has been already established when he campaigned for racist hillary.,0
"PSA: The pill that Maggie now holds is always a Speed Up ||| ""Lazarus bleeds more"" also makes it so once you become Lazarus II you get the anemic effect permanently without having to get hit ||| If only anemic did damage ||| According to the wiki it does do damage to enemies. [SEP] According to the Wiki, Raw Liver is an item that can appear in runs.",1
Grew out of this one pretty fast ||| Temporal imprecision is not correlated to gender. ||| Evidence? [SEP] You need to check your privilege!,1
"Secret Service: Guns banned from Trump's NRA speech ||| But I thought everyone should carry guns at all times? [SEP] With how demented some on the left have become when it comes to President Trump, better safe than sorry.",0
"""Melo is 1 of just 5 players currently averaging at least 21 points, 7 rebs & 3 assists (other 4 are Durant, LeBron, Paul George & B Griffin)"" ||| Four players have played at least 500 minutes, and a 20.2% assist rate, and 12.1% rebound rate; Blake Griffin, Draymond Green, Joakim Noah, and Carmelo Anthony. [SEP] Nah but Melo is a ballhog dand doesn't pass tho",1
"4chan is where smart people go to act stupid, facebook is where stupid people go to act smart ||| If you think 4chan is filled with smart people then you are horribly misinformed about 4chan [SEP] 4chan - a place for dumb people that try to hide their stupidity by saying it's intensional",0
"Beware the Plutocracy ||| Ok, so Libertarian is making fun of the Occupy movement now.. Is it because as a subreddit we won't agree or support it? ||| It is because their solution for problems with government is more government. [SEP] But, like, with democracy, the people can like *decide* things that benefit the people.",1
"Saudi Arabia has beheaded a second Indonesian maid this week despite protests from the Indonesian Government, which is itself facing fierce criticism for its failure to heed calls for clemency for a number of foreigners on death row ||| This is how I know we're still cavemen. [SEP] Yeah, executing people for murdering children is so barbaric!",1
"Don't accept your acting roles, you're harming the community. ||| it's common for latinos to look white though....? [SEP] My hispanic bf is the whitest person I know",0
"Adam Baldwin on Twitter: ""What hard evidence is there that Obama doesn't want ebola in America?"" ||| What hard evidence is there that any of the Baldwin brothers is sane? ||| Very little, but it's worth pointing out that Adam Baldwin is no relation to the Baldwin brothers (who all look like carbon-copies of each other). [SEP] I see no evidence to prove that Adam Baldwin isn't a Baldwin brother",1
"Map of ethnic Albanian population within the proposed ""Greater Albania"" ||| Why is it that the Albanians in Serbia have formed a separate state (Kosovo) rather than attempting to join the Albanian republic? [SEP] It's the next step, that will be taken when the time is right.",0
"Schefter: Forte to NY Jets ||| Man how many clear-cut bellcow backs are left in this league? ||| AP, Bell, Miller, Gurley [SEP] I know it's not really ""clear cut"" but isn't David Johnson expected to be a bell cow this year?",0
"My grandfather's WWII medals ||| Those are very cool. ||| The Nazi's weren't very nice people, but damnit if they didn't have style! [SEP] Yes, because Americans have been so nice throughout history",1
"What grounds do you need for saying that someone is not a true Christian? ||| Do they reject the Nicene or the Apostles creed? ||| Yes. ||| That'll do it. ||| Why do Christians attach such importance to these creeds? [SEP] Because they were universally agreed upon, with the Nicene in particular, in the Early Church.",0
"Germany rejects calls to give Greece more time for budget goals ||| Why does Germany think they can control the world? [SEP] Why do Greek politicians think they're going to spend German taxpayer's money, without oversight?",0
Kid tells his Catholic parents he's an atheist. ||| I just realized how incredibly lucky I am to have rational parents. [SEP] I realize everyday in this subreddit how lucky I am to have a family of atheists.,0
"Make this happen for smash bros Nintendo! ||| Why won't you people accept that controllers change? ||| Because this is probably one of the best controllers ever made. [SEP] Yes, the d-pad is great for fighters like SF and 2d platformers and the c-stick is the best for fps",1
"What other years were the ""worst ever""? ||| Maybe one of the years everyone just died from the Black Plague. [SEP] Ultimately though, the plague helped bring about the end of the feudal system, so it couldn't have been all bad.",0
"Britain set for first coal-free day since the industrial revolution: The UK is set to have its first ever working day without coal power generation since the industrial revolution on Friday, according to the National Grid. ||| I hope the government keeps ramping up nuclear power production. ||| The smart move would be to focus on ramping up renewable energy and keep nuclear as a backup. ||| Or fusion power, which is unlimited. ||| They... still need to build that ramp, let alone 'ramp it up' [SEP] Just 15 years away, I hear!",1
"Rekt. ||| China is a *fucking* shithole and produces a lot of rude, selfish people. ||| Extremely racist too. [SEP] But I thought only white people could be racist?",1
"Lin-Manuel Miranda, Donald Glover, Issa Rae & Damien Chazelle: Epic Conversation on Creativity ||| Donald Glover is the man he can do no wrong, been killing it ever since Community. [SEP] I'd say he's been killing it since Derrick Comedy.",0
"For all the hate Millennials get, Boomers are a special kind of scumbag ||| You keep using that word, but it doesn't mean what you think it means. ||| Fascist is just a codeword for people liberals don't agree with. [SEP] It's because it's so close to 'racist' that sometimes I think they just get confused and use the wrong word.",0
Hold your phone sideways! ||| Every phone should give that exact warning when the user starts filming in portrait mode. ||| Every camera should DISABLE video whenever it's turned vertical. [SEP] But what about those instances when taking the video in vertical is legitimate and superior to AHAHAHAHAHAHA i can't,0
"When a girl explains how she wants something done during sexy time ||| A good starter tip would be to not refer to sex as ""sexy time"" if you are older than 12. [SEP] Totally disagree, that's just a fun way to put it.",0
Stephen Colbert's wife makes a cameo on the Late Show ||| Well that's the most adorable thing I'm going to see today [SEP] That's what the liberal media wants you to think!,1
"Atheist academic calls for religion 'to be offended at every opportunity': Dawkins says it's ridiculous to be accused of racism when you criticise Islam ||| I find it appalling that Christianity is fair game for mocking, but if you criticize Islam you will be called a racist or an ""Islamophobe."" ||| Do you also find it appalling that no one is calling on a total ban of Christians entering this country? [SEP] The Western world is built on Christian values.",0
"new to game, how do I iron sight? ||| Anyone know if there are attachments for the guns and if not when they will be added in? ||| What attachments other than bayonets exist in this era? [SEP] I don't even think Bayonets would be viable (except on musket) judging by the.../unique/ designs of some of the guns.",0
"Cat teaches kitten to break the rules ||| I for one am shocked that the gate failed to keep out the cats. [SEP] I'm guessing it was never meant to keep out the momma cat, but just the kitten (who is more likely to be traumatized by a dog or toddler).",0
"Statistics of Ricardo Quaresma so far this season ||| does MAC mean games played? ||| yes , mac = match ||| So the Fener and Gala matches are the Big Macs? [SEP] Well nowadays there more more like McFeasts...",1
"Atheist academic calls for religion 'to be offended at every opportunity': Dawkins says it's ridiculous to be accused of racism when you criticise Islam ||| I think a lot of people get it wrong, here's a simple guide: **When you should offend** - When people are unfairly asserting themselves on you - When people believe in capital punishment even though it is fucked up, has been abandoned by most of the world, and doesn't act as a deterrent or save prison space or money - When people believe in flogging, amputation and other disgusting 'punishments' **When you should avoid offending** - When people have beliefs that seem silly to you but are not realistically causing problems - When you're doing it for no other reason than because you can - When it's divisive and doesn't actually help the situation (i.e., cause people to change their minds) [SEP] Unfortunately, Dawkins seems to not care about when you should avoid offending, It's no surprise however, he's basically the idol for militant anti-theists.",0
"Woman in leading Flint water crisis lawsuit slain in twin killing ||| Why do people still live in Flint? [SEP] Because, rather than go to school and become smart like you, they choose to be poor and stuck in a shitty crime filled city.",1
"Mario Party 8: Nobody Ever Wins - PART 2 - Game Grumps VS ||| Can't wait for the hot drama over the ""subsblibe"" banner once again. [SEP] Personally, I can't wait to make a big deal out of people making a big deal out of the subscribe banner.",1
"Reddit, what is something you just don't get? ||| I don't get diarrhea after eating Taco Bell. [SEP] I'm stuck on the toilet because of Taco Bell *right now*",0
