input_text,label
"Kim Richards Arrested ||| You know this is all Kyle's fault ||| Tbh, with a sister like Kyle, I wouldn't blame her =/ [SEP] I mean Kyle stole her house",1
"Arrogant International student gets caught speeding in Australia, doesn't take it well ||| Here in the good old USA, as soon as he touched the guy he would have been on the ground in a figure four leg lock. ||| i was just thinking this myself, as soon as the guy touched the police office i was thinking ""minimum another ticket, worse case for the guy handcuffs"" ||| Wow, I am glad I don't live in America. [SEP] Yeah, I mean you should be able to touch police officers as much as you want, especially when you're angry",1
"Texas, where the heat makes you THAT whipped ||| Reddit, where we make fun of guys trying to watch the game then go home and get laid. [SEP] Does making a genuine effort to get laid make you infallible and immune to criticism?",0
Can we sign that Lastname guy ? ||| Canucks sign RW Firstname Lastname for 2-years 4.5mil aav [SEP] That sounds like a EA NHL Create a player done quickly.,0
"Yadier Molina was find $5,000 for pushing Jerry Meals in Game 1 of the NLDS ||| I'm sure he did it the Right Way. ||| Cardinals fans such as BrommCJ would defend Hitler if he played for the Cardinals. [SEP] Yep as long as he has 30 HR's or more",1
"In the light of God's Not Dead and A Matter Of Faith, I present to you my Crappy Christian Movie Bingo. ||| ""Set in the American south **or** Atlanta"" Did the ATL jump a couple hundred miles geographically? [SEP] Child, anything south of Kentucky is the American south.",0
"HMB so I can hop on this cow ||| Dude is lucky to still have his skull intact. ||| who cares about the dude he probably damaged the cow's back for nothing ||| Dude, cows are tough as fuck, they can carry a lot (think weight of your parents disappointment in you). ||| I was thinking more like the weight of your wife [SEP] Ouch, that really must have burned so much",1
"25,000 Nova Scotians on wait list for family doctor ||| One would assume you need more doctors. ||| It's almost like we should be bringing in doctors and nurses from other parts of the world and helping them establish a life here so we can benefit from their services. [SEP] Or maybe having more spaces in schools and programs for Nova Scotians to become doctors, likely more willing to stay in the province.",0
"One of the best moments from the show ||| If you think *that* is one of the best moments from the office... you might be an idiot. [SEP] If you have a different opinion than me, you might be an idiot.",1
"What I'd do with a portal gun ||| Every time people mention having the portal gun IRL, I like to ruin their fantasy by bringing up the notion that the portal gun only works on one specific surface - namely, moon dust. [SEP] hey, I'm not sure if anyone else told you this yet but he only said it was **a** good portal conductor, but that doesn't mean it's the **only** one.",1
"Great room in this cabin-sytle home brings the outside in through fold-away walls in this home in Martis Camp (near Lake Tahoe). ||| Ugh, it's so close to the neighbors! [SEP] Its another house but inbetween is the most awesome 18 hole putting course.",0
"12 year olds vs 10 year olds. ||| Im 21 and I play Guilty Gear, I wish kids played it so I could feel a little better about my own ability. [SEP] At least you're probably better than like, 3 or 4 of the 15 people playing GG.",0
"Why are Russian citizens mad at Turkey for downing a deadly aircraft that was violating its airspace when Russia has yet to apologize for the MH17 incident? ||| don't Americans get upset when their soldiers die on foreign soil? [SEP] Na its totally chill, we wouldn't react at all",1
"Mass Effect: Andromeda's Trophy/Achievement List Is Here & It's Full of Massive Spoilers (Be warned.) ||| Somebody that's read it: On a scale of 1-10, how spoilery is the list? [SEP] The end - *Let x live while x dies* [100]",1
"where do i find this car ? ||| pretty sure its only used in a singleplayer mission ||| But I beat the game, and I've never seen it. [SEP] if you pick option b for the last heist you [need to steal it and use it to drill the hole to the safe, but it doesn't spawn outside of the mission]",1
"Cough bullsh#@ cough ||| How can Brady be the best ever when Peyton is the best ever...? ||| ""Tim Tebow is the best ever"" - ESPN [SEP] College football maybe, and you can't even seriously claim that.",1
"Scott: ""I'm working behind the scenes on several things; and I hope to be able to tell you about them soon!"" ||| This implies that he is working on *multiple* things we don't even know about. [SEP] Rule#1 of Scoot never underestimate what he can do",0
So This Quote Was Approved for Our Yearbook ||| There's a douchebag in the background of this fine picture of an elbow. ||| I bet he's actually a really nice guy. [SEP] He's wearing a hat backwards MUST BE A DBAG,1
olof jumping awp shot ||| Absolutely unreal ||| tbh I thought it was kind of meh [SEP] BUT IT'S OLOF SO THIS SHOT MUST BE IMPOSSIBLE TO MAKE BY NORMAL HUMAN BEINGS,1
"A Tribe Called Quest - We The People / First single from the iconic hip hop band since 1998. ||| sooo im guessing they aren't pro trump? [SEP] of course they are, they even named their last song the donald in honor of his win.",0
"SEGA will release more ""high quality PC ports"" of past titles in the coming months and years. ||| Wish List: Sonic Colors Sonic Unleashed Sonic 2 Mobile Sonic 1 Mobile Shadow the Hedgehog (yes I know I'm the only person who likes this game) Virtua Fighter 5 Crazy Taxi 2 Jet Set Radio Future Sega GT Online Puyo Puyo Tetris and Super Monkey Ball Deluxe. [SEP] Sonic Colors running though Dolphin looks pretty great, though the pre-rendered videos are still pretty bad.",0
"F-35 vs F-16 BFM Full Report ||| Sounds like software limits are holding back the maneuverability of the airframe. ||| Dude 90% of people aren't going understand how important software loads are to modern combat aircraft, so its just going to sound like an excuse to them. [SEP] It's fine, just write the software, easy fix.",1
"EU warning over Russia 'land grab' in South Ossetia border row - BBC News ||| Wow I'm glad they warned us about it, now everyone can continue doing nothing. ||| I wish Merkel took as hard a line with Russia as she does with Greece [SEP] No, punishing your friend and ally is a much better strategy!",1
"Cristiano Ronaldo becomes the fastest player in Europe to score 350 goals with a club. ||| Jose Bican scored 395 goals in 217 games for Slavia Prague. [SEP] yeah, but it's not about who did it the quickest it's the *fastest player* to do it, and I'm pretty sure Ronaldo would win in a race",0
Bernie Sanders: I happen to believe that Henry Kissinger was one of the most destructive secretaries of state in the modern history of this country. ||| The biggest tragedy for Bernie Sanders must have been how Kissinger's geopolitics led to the collapse of Soviet Communism. [SEP] I'm not sure you even know what communism is.,0
"Cultural differences ||| I wonder if all that extra clothing makes them overheat faster than the other players? ||| They won't get skin cancer ||| Because Humans have existed for hundreds of thousands of years across the globe, to get skin cancer so easily from being outside for a few hours. [SEP] How often do you think they practice 0.o you know, because pro athletes only practice once outdoors before a contest",1
New NASCAR 15 pic update - Talladega ||| I would like to direct everyone's attention to the 33 and 1. ||| They have no tires...that's pretty bad. [SEP] It's showing NASCAR's future Series the Hover Car Series,1
"Redditors, what would you name those 7 newly discovered planets? ||| Name them after scientists who changed the world... Galileo Einstein Nikola Hawking Vinci Sagan Newton [SEP] Not a meme or joke answer - downvoted",1
Los Angeles Is Proposing To Tax Millionaires In Order To End Homelessness ||| Taxing millionaires won't stop addiction or cure mental illness. [SEP] But rich people are greedy and we should take their money just because!,1
"Mika Hakkinen's incredible pole lap at a very wet Spa during the 2005 DTM season ||| God that sounded like an F1 sedan [SEP] Seriously, I think they just took a V10 straight out of an F1 car and put it straight into that Mercedes with zero modification",0
"Ibrahimovic accused of abusing referees in English or Italian so they can't understand insults ||| How many languages does he know? ||| At least 5 - Swedish, Dutch, Italian, French and English. ||| And he speaks Bosnian too. ||| Bosnian, Croatian, Serbian. ||| That's cheating a bit, might as well throw in Montenegrin as well then [SEP] Nah, they are all Serbs anyway.",1
"China grants Trump a trademark he's been seeking for a decade ||| So can we take back our country from globalist businessmen yet? [SEP] And give it to what, the other globalist businessmen?",0
"This guy only had bumps and scrapes. ||| Lucky bastard ||| I'd say the lucky bastard is the guy who didn't get into any wreck in the first place. [SEP] Yeah how about we just start taking pics of the average commuter, and praise the for being lucky?",1
"Especially if they're in the left lane on a highway. ||| If you want to see stupid, look in the mirror. [SEP] Oh man you got me good you fucker.",0
"Ja, Mein Waifu, Ja! ||| So this is what the world would be like if we lose WW2. ||| Oh shit that's still going on? ||| Isis is just another reincarnation of Hitler, didn't you know? [SEP] Yeah, that Isis guy is a real prick.",0
"Emails Show Hillary Clinton's Email Server Was A Massive Security Headache, Set Up To Route Around FOIA Requests ||| This doesn't sound like it should be legal. [SEP] Its not, but she's rich and powerful, guess we all better call it a day and drink thier cool-aid.",1
"Dog receives 210 plastic bottles as a Christmas present. ||| Anyone else think it's not a safe thing to do... If you look they left the caps on the bottle as well. [SEP] Yeah, not really safe but sometimes my dog finds old bottles with the caps on and chews them but never swallows the caps",0
"Bring Back the Long Form Census - private member's bill to be debated today. ||| Lets hope he succeeds, but the conservatives will probably shoot it down because how dare we spend money on making the country better. [SEP] Why base important government policy on accurate statistics?",1
"What lie about your city or country are you tired of hearing? ||| No body really is interested about Zambia to hear any lies about it. [SEP] Didn't some Scottish gap year girl write a book/article about how Zambia was an awful place, which was pretty much entirely untrue?",0
"A Film student let a thief steal his smartphone and followed him for several weeks with a hidden app - This is his film (2016) ||| Sympathy for a worthless, lazy dumbass thief. [SEP] i see a poor lonely immigrant trying to survive in a strange country.",0
"Faced with a cash shortage in its so-called caliphate, the Islamic State group has slashed salaries across the region, asked Raqqa residents to pay utility bills in black market American dollars, and is now releasing detainees for a price of $500 a person. ||| Looks like blowing up that Daesh bank a couple weeks ago has had the desired effect. [SEP] That Obama fer ya, destroying economies since 2008.",1
"Samuel L. Jackson leads outrage after Ben Carson refers to slaves taken to US as 'immigrants' ||| immigrants to work building pyramids for grain storage ? [SEP] Yeah, all those jewish immigrants that built it before moses convinced them all to pack up and leave",1
Ronaldo joking scores with his hands after being called offside. ||| Before the conspiracies go up: He wasn't carded because he was called offside before the attempt [SEP] Sad to see how many people on this sub don't seem to get it.,0
Former WWE Champion wants to stick his foot up Manny Pacquaio's ass over anti-gay comments (and it's not CM Punk!) ||| I guess I'll never know who it is since the name ain't in the title. [SEP] I'll save you reading a Complex article - it's Batista.,0
"Red Bull paid 2 million dollars for this stunt ||| A huge bargain of an advertising investment: it's still getting reposted with their name in the title, years later. ||| And I still don't drink energy drinks. [SEP] Which totally proves the point you're trying to make.",1
"Youtube should have a tip button on music videos so you can tip like 25 cents~ to verified artists that share their music on the site. ||| If reddit has taught me anything, the site would be full of comments like ""Incredible song, I'd tip you if I could afford it :("" ||| Quality comment, I'd give you gold if I wasn't broke :( [SEP] I came here to say that!",1
"Car cuts off cyclist and goes into full road rage asshole. ||| What a raging lunatic. ||| It's little man syndrome. [SEP] Exactly, and if someone says otherwise they are just affirming the little guy rage syndrome.",1
Motorists hit with record-high gas prices ( around $1.42 this weekend ) ||| Expect a large spike in transit use if this continues. [SEP] Most transportation companies will hedge their gas prices to prevent situations like this.,0
"Israel caught forcibly sterilizing their Ethiopian population under the guise of providing vaccinations, explaining their recent drop in birth rates ||| So this would be classified as genocide if I'm correct, and most people know that genocide isn't very nice. [SEP] It wouldn't, because it's not people they were sterilizing but untermenschen",1
"Man dead of gunshots in Market, more fired in Blackburn Hamlet ||| How about bringing stop and frisk to downtown Ottawa? [SEP] yeah but only to black and minorities right?",1
Saw this on the GTA IV Realistic mod video. ||| No way that GPU could run it at 4k [SEP] No GPU ever THANKS FOR THE AMAZING PORT GUYS,1
"Seville Cathedral ||| The architecture, the lighting, the poses, texture and the colors, the pictures within pictures... this has everything. ||| Except that it doesn't look like Renaissance art. [SEP] Yes, there are no depictions of churches in Renaissance art",1
"White Supremacy trash- BTW guys she's looking for a job! ||| As someone responsible for hiring people and a black man, as long as she can cover the tats and remain objective while on the clock, she's still not getting the job. [SEP] May I just compliment you on your username and astounding wit?",0
"Nexus 7 Successor Will Ditch Nvidia, Opt for Qualcomm Instead, Says Report ||| I think the more pressing issue here is what they're going to call the nexus 4/7/10 successors [SEP] they should do the nexus 4^2 and so on.",0
"Tesoro Gram Low Profile G11SFL Red Mechanical Switch Full Color RGB LED Backlit Illuminated Mechanical White Gaming Keyboard - $118.99 ($136.72 - $21.00 = $118.99 ) ||| What justifies the price tag of $118 on a khail switch [SEP] I can't fully answer that question, but this is one of the few mechanical keyboards out there that feature low profile keycaps.",0
"Woah, that's messed up. ||| [](/flutterjerk) Gee America, you're really good at making people hate you. ||| [](/flutterpaint)It's an art. ||| [](/abmeh) *half serious comment about 9/11* [SEP] [](/intensefire)Woah mate that's so offensive I'm triggered",1
"New DeLoreans returning in 2017 at $100,000 apiece ||| Interested to see what they look like. [SEP] As long as they don't let Will.I.Am anywhere within six miles of the design board, it'll be OK.",0
"Some of the BEST investors compared with the S&P 500 over time. ||| I'm probably biased from reading The Big Short recently, but shouldn't Mike Burry be on this chart and totally dominating it? [SEP] Can't put a guy who gets his hair cut at supercuts on this chart",1
"(NSFW) Reports of a massacre carried out by SAA/NDF against civilians in #Idlib before fleeing - 15 confirmed so far ||| How this subreddit turned into a pro-terrorist propaganda mouthpiece in the last 4-5 weeks is really astonishing. [SEP] Because they cried for months that this is a pro-assad subreddit, until normal common sense people left this sub.",0
"Obese people of Reddit: if you sit next to me on a plane what should I do (aside from silently resenting you) to make the situation the least uncomfortable for both of us? ||| Be a friendly, outgoing hot chick... that should do it. [SEP] He wrote ""least uncomfortable for **both** of us""",0
"Hillary's emails confirm France and US killed Qaddafi for his gold and oil ||| So.. Panama Papers link her campaign manager to things, and her emails are linking to more great things.. awful campaign, just a terrible group of people. [SEP] But it's about time for a woman to get in the White House, so let's vote for her.",1
"What do you think will be the most expensive transfer of the January transfer window? ||| Whoever we inevitably buy ||| Hopefully some damn defenders [SEP] Nah, you'll probably end up buying Cavani, Hulk and Reus",1
"Twice as Nice: T-34-88 and Centennial Chieftain ||| **Choice T-34-88 Quotes from the community** ""Thanks for making me wait until the 26th for the base bundle"" - **paddyotool** [SEP] Whats another couple weeks when youv been waiting a couple years already.",1
Big 10 with 4 Teams in AP Top 10 - First Time since 1960 ||| 4 teams in the Top 10 and not a single other team even sniffing the top 25. [SEP] Uhhh excuse me our 3 also receiving votes in the Coach's Poll beg to differ,1
"Art Acevedo is staying in Austin, with a raise ||| Why can't the city afford to fix the windows that are still boarded up on the front of police headquarters? [SEP] they're red oak and mahogany stained on the inside",1
"Mario Players in a Nutshell ||| Thank you! ||| Have you ever considered making a Ness players in a nutshell before? [SEP] Ness is can't be high tier, because Rosalina is an unwinnable matchup",1
"As a Redditor from Germany who finally got good grades in English. ||| Not sure how to feel about Germans thanking nazis but I'll let it slide. ||| It's *their* n-word [SEP] So it's cool for us to throw around ""Nazis"" like crazy after 68 years, but after a few centuries it's still not cool to say the 'n-word'?",1
"With days to go, GOP convention struggles with $6 million shortfall ||| What the fuck do they do with $64m? [SEP] hmmm let's see now $59700000.00 -- 30 million X 100 pack of red balloons @ $1.99 each $4210000.00 -- sundry rude Hillary stickers and buttons $79000.00 -- breath mints $11000.00 -- hair spray = 64 million bucks",0
"How many licks does it take 'til you get to the center? ||| I swear to the lord if anyone says ""thicc"" [SEP] When you tell a girl you like thicc women this is the friend she wants to set you up with.",0
Leaked Trump tape: 'You are the special people' ||| He hasn't divested himself from his business. [SEP] No proof he's sold his stake in DAPL either.,0
Top Clinton aide Cheryl Mills granted partial immunity in email investigation ||| Can any of you Clinton supporters explain why so many people surrounding Clinton need immunity deals if nothing illegal happened? [SEP] Doesn't the fact that these people around Clinton did get immunity indicate the FBI was trying to build a case against Hillary?,0
This wedding photo ||| Trashy people get married all of the time. ||| And reproduce all of the time. [SEP] Thank god for their trashy daughters.,0
"iPhone 7 announced with water resistance, dual cameras, and no headphone jack ||| This is a big fuck you to people who don't have Bluetooth compatibility with their car as well. [SEP] If you don't have that you are just some poor pleb who should be allowed to buy apple products",0
"If you travelled back in time to 2006, what is the most surprising thing you could tell an NBA fan? ||| Dell Curry's son is arguably the best player in the NBA. [SEP] Seth ain't bad, but I wouldn't say arguably best in the league",1
"What simple thing do more people need to know? ||| I don't care what they said, do **not** delete system32 [SEP] It is much more effective if you rename it to system64 if you have a 64-bit OS.",1
"TIL: a 2012 study showed that men who treat women the same as they treat other men, are seen as overwhelmingly sexist by both men and women. ||| My buddy Steve gets mad when I tell him to make me a sandwich. [SEP] Well, you sexist pig, how about making HIM a sandwich?",1
Kosovo set to land EU membership deal next week ||| So if Kosovo is joining can we also get Narnia? [SEP] Then after that maybe the Basque Country to join.,0
"Smiles On A Bus ||| That girl in the front is being way too aggressive ||| she seems like a humongous bitch ||| I too, make harsh, deep character judgments about people from a five-second glimpse at them. [SEP] I bet she doesn't even recycle",0
The LA Galaxy put together this highlight reel after losing to Orlando SC 4-0. ||| I can't watch that 'in my region' :( [SEP] wow some people these days dont have proxys on their google extensions...,0
"Okada hits the Rainmaker on AJ Styles ||| I still find it ridiculous that someone uses a clothesline as a finisher. [SEP] Yea, JBL and Stan Hansen were total jokes",1
Australian Rhino Project moving rhinoceros from Africa to protect against poaching - The first of up to 80 rhinoceros are on track to come to Australia this year as part of a world-first plan to ensure their survival ||| Great project...Hoping for a successful implementation. ||| Any chance that they would be an invasive species :v [SEP] Then they'll need to import poachers,1
"Pass on Pot Legalization Challenge, Feds Urge Justices ||| There should be monuments posted at the borders to commemorate this moment in history when the federal government stood up against the liberty hating states of Oklahoma and Nebraska to side with the freedom loving people of Colorado over a plant. ||| Some states just don't care about the 10th amendment. [SEP] Most people I talk to only think there is a second amendment",1
"O. Giroud goal vs Scotland (France 2-0 Scotland) ||| So satisfying to see him score so often after all the abuse [SEP] there's nothing more that says ""fck you"" than scoring in a friendly.",0
"Inside the home of a Saudi architect ||| repost from the top post of this subreddit [SEP] It's really hard to sort by top: all time actually, so I appreciate this post greatly.",1
Hamburg has become the first German city to pass a law allowing the seizure of empty commercial properties in order to house migrants ||| Because seizing property will totally resolve tensions between locals and 'refugees' [SEP] so basically you're saying you want to round up and kill all migrants.,1
"What is a phrase most often uttered by assholes? ||| ""not trying to sound racist but...(racist stuff here)"" [SEP] ""I'm not racist but don't you have how all black people steal?""",1
"AF1 stays the most iconic shoe ||| What are the grey ones called? ||| Air Force 1 ""*Grey*"" [SEP] Haha now I feel like a jackass",0
New Archbishop of Cracow Celebrates His Inaugural Mass Ad Orientem ||| Krakow* ||| Both spellings are acceptable* ||| Yeah but as a pole that one just irks me a bit [SEP] Would you prefer we call it Krakau?,1
"India agrees to give landlocked Nepal secure transit to Bangladesh by road and rail ||| This is a great step forward for India - Nepal relations, and very important for Nepal as a sovereign nation. [SEP] I think it'd be best if Nepal ascended to India",0
"Palestinian Christians 'bitter and left out' of Easter celebrations ||| Jerusalem should be an International city, policed by an international police force. [SEP] If you think Israel will trust others for their security you haven't taken even a cursory study of the last thousand years of history.",0
"Life is really simple, but we insist on making it complicated. ||| What is that even supposed to mean? [SEP] I'm pretty sure it's supposed to mean that eating meals composed of mostly meat/dairy and refined carbohydrates leads to our high levels of obesity and the resultant problems complicate our lives",1
Springtomize 3 is releasing in less than a week! ||| So what small tweaks can be replaced by this? ||| Everything [SEP] Yeah but doesn't Springtomize take up a lot of memory?,0
"Rs3 just got a 'duel-anywhere' system, where you can have a fun duel anywhere, with anyone you please! ||| can you imagine the bugs with this ||| No, not really ||| lol there have already been significant glitches with it in RS3 who have a massive dev and QA team, a team of 2 people working on this is asking for trouble [SEP] I believe this update was worked on solely by Mod Pi, as for QA, I'd assume the small sized Ninja team tested it but there's no way to be certain",0
"Russian military considers return to Cuba, Vietnam ||| Oh man they're getting the band back together [SEP] It sure was one hell of a racket.",0
"Post Match Discussion Barcelona 2:1 Manchester City ||| Ref was just horrible, for both sides. [SEP] This is supposed to be France's best referee...very disappointing.",0
"YOU SAID IT WOULD GIVE ME WINGS! ||| Looks like he hurt his right arm. ||| I mean, running into a sofa dispenser straight on with nothing but your arm as a cushion might do that. ||| What kind of sofas does this machine dispense? [SEP] Mobile Reddit is great for posting comments",1
"Penn and Teller take on the anti vaccination movement ||| Oh, we are reposting this again? ||| I for one am glad, as I missed the previous times it was posted! [SEP] Yeah because everyone knows that once something is posted on reddit the whole internet has seen it",1
"Police Officer Helps Speeding Student Tie His Tie ||| I've never seen a police officer who wasn't clean-shaven, I didn't actually know they were allowed to grow beards. ||| In India, police officers are paid more if they grow a beard / mustache [SEP] To take note while Sikhs can, even Hindus during Ayyappa rituals, Muslims are not allowed to grow beard in India in most departments.",0
