input_text,label
"If Democrats want to win, they should filibuster Trump early and often ||| If they do 2018 will be twice the bloodbath it is slated to be. [SEP] Just like the Dems won in a landslide in 2010 because the voters wanted to punish the Republicans.",1
"MRW I am a Cubs fan watching Game 7 and my girlfriend says, ""It's okay if they lose, it's just a game."" ||| That is the most condescending thing you can say to a fan of anything. [SEP] It's okay if your clothes all get ruined, they're only clothes.",0
"Disney's new Latino cartoon criticized for not depicting the horrors of colonialism ||| As a Mexican-American, I guarantee you that everyone complaining, are white people. [SEP] Well you can rest easy knowing they're fighting the battles you truly care for.",1
"Obama administration asks Supreme Court to allow warrantless cellphone searches ||| More obama police state, and I thought bush was bad. [SEP] Down voting the truth dose't change whats happening.",0
David Starkey destroying Laurie Penny after she calls him a racist ||| David Starkley **OBLITERATING** Laurie Penny ||| David Starkley **LITERALLY RAPING** Laurie Penny with **THE COCK OF TRUTH** without even using a **CONDOM OF COURTESY** [SEP] His finger pointing was the male embodiment of **PENIS THRUSTING** her in to submission!,0
This week's Final Edition is KJ Wright. ||| Great another week where people complain about no Flacco [SEP] He shouldn't get a FE for this season tho,0
"Vladimir Putin Says Brexit Caused by British Politicians 'Arrogance' ||| I don't like agreeing with Putin but he's right, both the Conservatives and Labour have ignored a generation of working class people, can you blame them voting to leave ||| You know its bad when Putin can legitimately criticise you. ||| I new it was bad when Trump said it was good. [SEP] Think like a transistor and be unpredictable.",1
"When you don't understand symbolism in fiction... also, Neville. ||| Petunia is skinny and loathsome. ||| Is that thinphobia or is that totally acceptable? [SEP] Why did you say the same thing twice?",1
"'Shut up,' Duterte tells soldiers wary of pact with Reds ||| Recipe for a coup or assasination by soldiers. [SEP] Ingat-ingat din dapat si Dutz 'pag may time.",0
"I always wanted to be a baker ||| Baker Panth, Yorick rework... this is the most appropriate time for the it's happening meme [SEP] we lack Pool Party Sona... but I guess summer's over on USA.",0
"Request silly images and I'll draw them dark and spooky ||| a puppy ||| I'd prefer if it were FNAF related, to be honest. ||| a robot pup [SEP] You could've just asked for Sparky",0
"Brave kid that knows the law makes cop shut up and walk away. ||| Thats also how you be a sore winner, juvenile prick. [SEP] Never met a sore winner cop in my life!",1
"The IMDb ratings for Fifty Shades Darker. ||| Fivethirtyeight did interesting statistical analysis that shows how male rankings tank movies directed at females, but the opposite doesn't happen. [SEP] clearly this is because men get dragged along to movies they don't want to see, and women won't come with to see man movies.",1
"What is one thing you'd like to ask people from the UK? ||| How do you pronounce ""Worcestershire"" in Worcestershire sauce? [SEP] American here, I got you: It's pronounced Wor-chest-er-shy-er.",1
"Germany, Not America, Is Now The Leader Of The Free World ||| Wow, they must've really expanded their military over the past 72 hours. [SEP] You'd be surprised what the Volkssturm can do when you're willing to commit to Total War.",1
"Hey, Shitty_Watercolor made it to CNN! ||| It's Shitty_Watercolo*u*r ||| I'm sure he's honoured whether they spelled his name right or not. ||| You're right man, I didn't do shit and *I* feel honored. [SEP] It's okay buddy... It's okay... Have a kleenex Crying_Indian",0
"Deported gay Afghans told to pretend to be straight | UK news ||| Surely if the advice your giving them is pretend to be straight, your admitting that are going back to persecution and thus would be allowed to claim asylum here ||| They would not be going back to persecution if they pretend to be straight. [SEP] Yeah, because it's not persecution if you pretend it's not.",1
"McGamer gif featured in distractify article about... parenting? ||| Since when did ""article"" mean ""picture story book""? ||| what else was i supposed to call it [SEP] ol' trout lips gif featured in clickbait garbage",0
"PAX East Replay: 0.60 Map Changes Tulga/Elektro/Cherno parts only (Multicam fix: Non-stop Fullscreen) ||| Is that ""mist"" permanent or does it eventually fade and disappear? [SEP] It's weather-based but will always be more prevalent at the coast/lower elevations.",0
"$1,000 smart iron.. Seriously can't figure out the benefit ||| If I had $1000 dollars I'd use it to pay someone else to do my bloody ironing. ||| Yes, this is the stupidest fucking thing I've seen all year. [SEP] The help can have nice things too.",0
Kong Hee's Sentenced Reduced from eight years to three years six months ||| We really ought to worry what kind of message that this is sending out [SEP] Prepare to see more cases like this in the future.,0
"BTCC CEO: ""Let's get everyone to vote!"" ||| Vote should be function of bitcoin amount one holds I wonder if there is anon system for it [SEP] Yeah let's let only the rich decide, or get the more important vote, the little guys opinion doesn't matter.",1
US economy grows just 0.1% as weather blamed for putting chill on recovery ||| I'm sure this has Absolutely NOTHING to do with the rest of the world removing governmental contracts and refusing to business with the USA due to cyber-spying. [SEP] Do you have a source for how much the NSA has damaged the GDP?,0
"Grand Theft Auto V - 60 Frames-Per-Second PC Trailer ||| Honestly, the trailer was a little dissapointing. ||| 60FPS was nice, but damn the trailer was too short. [SEP] 60FPS is twice as fast as 30FPS thus making it shorter.",1
"Ukip named UK's most hated brand, followed by the Tories and Marmite ||| Curious that the likes of the BNP don't even get a look-in. ||| UKIP took most of their spotlight despite not being as (overtly) extreme. ||| UKIP are not extreme. ||| They try very hard not to be, I'll give you that much. ||| Which of their policies do you think are extreme? [SEP] They don't want an open-door immigration policy, that's very extreme.",1
"I'm calling B.S.... pastor has heart attack at church, is revived by parishioners and claims a miracle ||| Five nurses and CPR... sounds like a miracle to me... NOT! [SEP] god created the heart attack to test the nurses faith",0
"Kermit the Frog gives himself a pep talk ||| His Kermit voice is kinda shitty to be honest [SEP] It'd be a lot better if his voice was deeper, you can definitely hear the resemblance but his voice is just too high pitched.",0
"Vitalik Buterin - ""If in the future there is that kind of a dispute in Ethereum, I'd definitely be quite happy to see Ethereum A go in one direction and Ethereum B go to the other"" ||| ""We will bailout people if we deem our interests are at risk against our core vision of ethereum which may be changed anytime for our own gain"" [SEP] but but but there's one bad guy who did something bad, lets write a ton of code and waste a month to punish him!",1
"Grant Wahl on FS1: MLS league office ""will be addressing this soon with the LA Galaxy"" in regards to the Viral video yesterday ||| Regardless of how they should have behaved, the video was hilarious ||| I can't imagine there is a rule against this, but I'd love to know what it is if there is one. [SEP] There isn't one but, of course they'll make up some new rule because Galaxy.",1
"Taking Off Her Panties - Imagine if a man did something similar, he'd be in jail instantly ||| Ironically, not one of these poor saps tried to rape her... [SEP] Because they saw the cameras but pretended they didn't, shitlord!",1
"RONDA ROUSEY LOSE UPVOTE PARTY BEAUTIFUL, CHAMP! ||| CM Rousey ||| Cm punk lasted 2:14 [SEP] ""Yeah, please have some respect""-**CM PUNK**",1
"Do both as I say AND as I do? ||| Gosh, I didn't realise that was actually possible :D [SEP] Who did you prefer working with, Souleye or Chipzel?",0
"My Age of Ultron experience was ruined this weekend ||| If you can't afford the babysitter, you can't afford to go to the movies that night. ||| Why don't theatres just ban babies? [SEP] Because OMG I'M OFFENDED AND ENTITLED YOU CAN'T DO THAT",1
"Bernie Sanders: Climate Change Is The Biggest National Security Threat ||| It's not particularly untrue but I couldn't help but think he was dodging a weak policy topic for him (foreign affairs). [SEP] Climate change is the only threat that is occurring right now on our soil, with the potential for irreversible damage.",0
"I'm willing to spend countless hours perfecting my MMO character but i halfass my way through real life. ||| Well if only life was third person I might actually care about what I look like. ||| Actually, your life is third person for everyone except yourself [SEP] Kinda missing the point there mate.",0
"Duterte hits 3 'most corrupt' government agencies ||| I could be wrong, but how did he determine what agencies were the most corrupt without having access to government files yet? [SEP] bulong bulong sa mga bespren... walang bias yan",1
"Til that Chimpanzees and monkeys have entered the stone age ||| Pretty soon they'll be just as advanced as the Muslims are. [SEP] Islamic golden age don't real Persians were literally cave men, algebra is named after European language, algorithm comes from European mathematician!",1
"MRAs are rapists, somebody thinks patriarchy and traditional gender roles are interchangeable, then the typical feminist lie parade gets trotted out. ||| It's weird how they are simultaneously virgins and rapists. [SEP] Reddit is simultaneously 15 year old virgin fedora wearing losers, and 40 year old pedophiles when someone posts an image of a 16 year old girl.",1
"""Menurut saya, pak Gita Wirjawan itu orangnya baik, berwibawa, jago main musik dan tampan..."" - Dicky SMASH ||| if i'm gita, i would be scared as shit, imagine group of flamboyant men saying you're handsome etc etc... such a lousy political ads. ||| Each of those flamboyant man held the same amount of vote in elections as you or me or a Harvard PhD graduate, just saying. [SEP] i'm afraid of those SMSH fans, and less educated people on rural area, tbh",0
"Apple Said to Ship New 'Ultra-Thin' 13"" and 15"" MacBooks by June-July ||| oh thank god i was just sitting here thinking about how gosh darn thick the retina macbook is [SEP] Yeah, i'm just sitting here with my 2 week old rMBP disgusted by what a fat pig it is.",0
"If God orchestrated evolution, then he went through a phase playing with dinosaurs ||| If evolution orchestrated God, then we're still in the phase of playing with him. [SEP] But if man created God in his own image, then we're playing with ourselves now.",0
"Opponent of Dem chairwoman raises $250,000 following Sanders support ||| Why do they never say his name in these titles? [SEP] They used neither of their names in the title.",0
Everything Wrong With Toy Story 3 In 14 Minutes Or Less ||| Surprised that you didn't notice the garbage man at the beginning was Sid. [SEP] That doesn't mean he's not a serial killer,1
"If California Adopts Universal Health Care, It Will Be a Model for the Whole Country ||| Please please please, just to show the rest of the country it works Oh to and to fuck with the Trump cult [SEP] I used to dream of being and doing many things in my life, but it's all been reduced to just one thing lately...move to Cali Cali.",0
"Found in the 1986 book: BY THE YEAR 2000, 2 OUT OF 3 AMERICANS COULD BE ILLITERATE ||| Need to build a wall to keep these illiterates out [SEP] But they're the ones who want to build it in the first place!",1
What is the stupidest conspiracy theory you have ever heard about? ||| The surface of earth is actually on the inside of a hollow earth. [SEP] How to put a nail in this theory: How is that simpler than the alternative?,0
"Salon's Tom Watson: Don't protest against the NSA, because there will be libertarians at the rally ||| As a ""social democrat,"" shouldn't Tom Watson be tolerant and understanding of other people's ideas? [SEP] Only if their ideas coincide with his and his party.",0
"Finally finished my sleeve and its all healed! ||| Looks super awesome, but outside of the Triforce at the top, I'm not sure what I'm looking at. [SEP] I am glad i wasn't the only one",0
"New runeccape boss - Max Giant ||| Wait, is this real or a glitch? ||| build a boss at runefest (im 99% sure it's a joke and won't be implemented) [SEP] No, it's coming in next week's patch :)",1
My friend met a nice guy during her closing shift last night. ||| I hate when guys try to tell me how I feel. [SEP] I can't think of a worse case of mansplaining than doing it about someone else's feelings.,0
"My state police department has now entered the danger zone. ||| But topgun had tomca- fuck it, nevermind ||| If you're going to get pissy about the type of plane used when making *Top Gun* references you're going to have to go to Iran because that's the only country where they exist outside of museums now. [SEP] Now I'm imagining a Persian Maverick and Goose",0
"TIL Philadelphia has a section of railway, home to a heroin epidemic so bad, that even the police have trouble going there due to the horrible conditions. ||| But hey, lets just drop this silly war on drugs, it's not like drugs are bad mkay? [SEP] the war on drugs is precisely why this epidemic has grown so out of control",0
So I guess it's okay to refer to the British government as 'fascists' if they're calling the UN housing report 'Marxist'? ||| This idiotic sort of rhetoric is why socialism struggles [SEP] But petty name calling is a true representation of the proletarian struggle!,1
"My girlfriend before we go out for an evening. ||| Yeah, except for how fast she changes. [SEP] should this to your girlfriend and tell her to practice being as fast as this girl",0
TMAF about you! ||| I'm swiss ||| I heard the flag is a big plus [SEP] haven't heard this one in a long time :P,1
"India tea workers kill boss over pay ||| Inb4 some libertarian tries to defend the free market. ||| I am a libertarian and I support the right of hungry people who have not paid and are treated like slaves to drag the slave owners out into the street and beat them to death. [SEP] If they weren't getting paid for their work, they could have quit and found work elsewhere.",1
"The Witcher 3 patch 1.10 went live on all platforms and brings 15gb of new content, dialogues, options add bug-fixes. ||| Every time they fix a bug they break other stuff. [SEP] Yeah I mean you'd think they'd be able to get 20gb of code perfect!",1
remember all the flame i got for this post well now you people can kiss my butt also i don't care if you downvote ||| holy shit you're actually pathetic enough to use vote manipulation because people don't agree with you [SEP] i just noticed this lmao he's votebotting the thread cuz he mad,0
"Jordon Ibe has picked up a hamstring injury in training ||| Somewhere, Brendan Rodgers has a Liverpool player voodoo doll and is doing all this. [SEP] This is what happens when you build character and not train intensively.",1
"French teacher invented school attack ||| Demanding a trial for this incident ||| Is there a specific law for this in France? ||| he used violence to inspire terror, he's a terrorist. [SEP] no silly, only brown people can be terrorists.",1
"Parliament shooting: Police officer and another man shot outside UK House of Commons ||| Donald Trump was involved in this somehow. [SEP] Well, this is Reddit, so he will be blamed for everything.",0
"10th anniversary today, thought we'd capture the romance. ||| The look on her face is a perfect summary of why I don't want kids. ||| Why would I want to put myself through that? [SEP] Yes, because nothing hard is worth doing",1
What isn't as bad as Reddit would have you believe? ||| Folks trying to flee warzones prolly aren't *all* doing it just to ruin your day [SEP] But don't you know they're literally committing genocide in Germany by stealing all the jobs and impregnating all the good pure white girls?,1
"Taxation is theft. ||| ITT: statists who think buying a woman's dinner means you get to rape her. ||| She consents by not running away from the restaurant. [SEP] More by eating the dinner, but yeah...kind of the same basic idea.",0
"Every one of the EU's 28 member economies is growing simultaneously for the first time in 10 years ||| Or as some political actors would put it, ""everything's falling apart"". [SEP] Yeah, who care about 20% of unemployement for 18-30 in most of southern countries, OUR GDP IS GROWING GUYS !",0
Schoolgirls report abuse by young asylum seekers ||| Don't accept them in the first place and shit like this will not happen! [SEP] You believe that no white man has ever raped anyone in Europe?,0
"What unpopular opinion do you firmly stand behind? ||| As an American, I am embarrassed by the overtly patriotic culture that we have. [SEP] Then leave, the last thing we need is bitter american hating people in our country",0
"Vegeta vs Saitama ||| Lol, this is going to get downvoted like crazy since people here freak out and get really pissy at the notion that Saitama could take on DBZ characters. ||| he is a gag character... he could take on anyone.... even xeno guy there's no point in arguing over this shit [SEP] Well I mean from what we've heard of xeno no one could even attempt to take him on because the moment you tried hes already removed you and the entire universe from existence.",0
Andrew Garfield has fallen on hard times since being recast as Spider-Man ||| Never realized how much he looks like Jean-Ralphio [SEP] Also they both look like Steve (Joe Keery) from Stranger Things,0
"What under-rated PS4 games people should play? ||| Bastion Child of light Dust An Elysian Tail Steamworld Dig Thomas was alone Valiant Hearts [SEP] im pretty sure you can play Bastion on browser, i'd change it with transitor ( is it under-rated thou?)",0
"Native American tribe votes to reject $25,000 offered by Washington Redskins foundation ||| And we see all these dumbasses talking about how it's only white people who complain that their name is racist. [SEP] But, some Native American high schools call themselves Redskins, so that means I'm immune from being racist.",1
"Samsung, HTC to block US, EU sales of iPhone 5 using LTE patents ||| ""Yes, let's block one of the biggest American corporations from selling one of the hottest products in America so that they can be outdone by companies from Taiwan and Korea,"" said no American judge ever. [SEP] Yup, because Apple manufacturers everything in the US",1
"I'm proud to be a vegan, so i made these wallpaper for you guys ||| Ah yes, the festering cesspool that is the comments section of Imgur. [SEP] The real question is who just browses imgur?",0
Wells Fargo exec who headed up phony accounts unit walks away with $125 Million USD ||| ...and 5300 of the employees under her got fired. [SEP] They should have put a $125 Million termination payout in each of their contracts.,1
"Police officer playing with children, Harlem 1978 ||| Looks like they are playing ""Duck, Duck, Goose"" [SEP] Red rover, red rover, send Sandy right over",0
"This couple was preaching on my campus today ||| But why is she in her bra and underwear [SEP] I thought she was doing some sort of Ebony BDSM and the sign was just another kink, not being human.",0
"Americans of Reddit, what would you like to know about us Europeans? ||| Why is no one saying what country they are from here? [SEP] We're all from the Europes, like one big happy family.",1
"Guns make little baby Obama cry :'( ||| Judging from when the White House first threatened executive orders, looks like he just spent a week learning how to cry on demand. ||| Obamas thoughts during the speech""Dead puppies, dead puppies, dead puppies"" [SEP] He ate a dog, he doesn't care about puppies either",1
"Just in case I get lost in the Multiverse. ||| Well that won't feel stupid five years from now when the show is not relevant ||| It really sucks when the time limit is up and you can't watch, like, or talk about a show after five years. [SEP] Yeah, and I'm sure anyone with a meatwad tattoo isn't regretting it at all.",1
If all 50 states in the USA were forced to put one boy and one girl into the hunger games which states tribute would win and which states tribute would be the first to die? ||| I'd love to see the final duel between the crazy Florida man with chainsaws and the crazy Alaska girl who can kill moose with her bare hands. [SEP] Im sorry but this crazy Alaskan girl sounds slot like Sarah Palin,0
"German woman molested in Goa, auto driver held ||| it's time to ban auto rickshaws if we want to remain consistent [SEP] Did auto-walas promise complete safety and background checks of the drivers?",0
"TIL first aid training is required to get a driver's license in Germany in order to ensure that in the event of an accident other drivers will be able to help ||| Lately, it seems like Reddit is giving me the distinct impression that Europe is doing absolutely everything right and is the best place ever to live, while the rest of the world is basically wallowing in shit. ||| Isn't it amazing what you can accomplish with a relatively homogenous population that shares common values? [SEP] Values that are mostly based ok having a compassionate society instead of everybody being on their own",0
Server Maintenance - June 23 20:00 PST (8 hours) ||| This update makes all the Kiritos happy. [SEP] Why do I have a feeling there will be even more now,0
"""Don't pick Zarya on this map dude!"" ||| all i can think while watching this: ""right click, hello?"" [SEP] I know, I know I got caught up in the moment and I don't usually play her.",0
"Apple, Microsoft, Google and other US firms to commit $140bn to address climate change ||| I'd be happier if they paid their taxes. [SEP] Yeah, that way the money can go to filling a new desert with depleted uranium and subsidizing oil companies!",1
Two B2 bombers just did a fly-by over our house ||| Stealth my ass. ||| That joke is so worn out. [SEP] But the top comment about someone receiving a double dose of freedom totally isn't worn out.,1
"Rich Democrats don't care about income inequality any more than rich Republicans. ||| TIME, telling us what we already knew for the last 92 years. [SEP] Cool, now can we stop thinking that it's only 1 political party that's the problem?",0
Belgian Police arrest driver trying to run into crowds in Antwerp - weapons found in driver's van. ||| Wow so I guess just being randomly run over can be added to my daily list of phobias [SEP] It should already be if you live in a country which has roads and/or cars,0
When this post is 15 minutes old Texas A&M will be having a press release to the public ||| It is beginning to appear that OP is one of them internet gays you hear about from time to time. [SEP] I got a temp ban from this sub for saying something like this,0
"Aggressive convertible driver passed me in the shoulder in a construction zone in heavy traffic ||| I'm starting to see the commenters in his sub get increasingly more hostile towards one another. [SEP] Its pretty much always been like this, there's always at least one exchange between 2 idiots who can't possibly be wrong somewhere deep in the below thresholds",0
"Run away as fast as you can. ||| I hate when people don't close their parentheses because I'm stuck reading the whole paragraph like its in parentheses. [SEP] Yeah that was definitely the deal breaker for me, apart from that she seems fine :)",0
"Man says he feared for his life when anti-Trump demonstrators trashed his car ||| ""i was just driving by"" after going mudding in the middle of the city, apparently. ||| With American flags on. [SEP] oh ok, he totally deserved it then",1
"Miralem Pjanic (Juve) goal vs Torino (1-3) ||| Joe Hart can only do so much [SEP] Except play it out from the back, clearly.",1
University of Delaware investigating three makeshift nooses hung after a black lives matter rally ||| How long till we find out it was done by black activists just trying to raise awareness to their cause. [SEP] once the immediate twitter fervor and faux activism around the case dies down,0
"Which team is most reliant on a single player? ||| Newcastle without Remy have an awful record this season. [SEP] He's also on loan, so unless we get a good striker and a replacement for Cabaye, I can see us near relegation next year.",0
"Why did people assume an Asian woman was the nanny? ||| The kids were clearly Asian so I immediately assumed it was his wife. [SEP] I watched the video 3 times and didn't notice she was Asian, so this whole drama is news to me.",0
"Video of Boy Shocked 31 Times For Not Removing Coat Finally Released ||| If this were my family member, there would be a few unmarked graves and a few less staff at the school. [SEP] If any place needs to get bombed it's not planned parenthood or abortion clinics - it's these torture houses.",0
"Bernie Sanders driven from stage at Social Security Rally by BLM protestors ||| I get that this is a social movement and not a political one, but very poor choice to protest against this man and this audience. ||| These protesters aren't exactly the brightest crayons in the box [SEP] I know this comment wasn't meant to be racist, but obviously your 'white crayon privilege' has gotten the better of you",1
