input_text,label
"Girl Send Stupid Tweet to an Airline, Gets Her IP Saved and Makes up a BS Story to Cover it up ||| No matter how you slice it, Sarah is a dumb bitch. [SEP] Who got like 20k retweets so the jokes on you!",1
"Kelly Osbourne to Trump: Without Latinos, Who Will Clean Our Toilets? ||| How is that not a massively racist thing to say? [SEP] You have to understand, Kelly is a liberal and heart was in the right place.",1
"3 Fan Communities That Hate Their Own Members ||| Actually it's about ethics in indie music journalism. ||| Truly, the most corrupt and colluded journalism ANYWHERE. ||| All these girls claiming to listen to indie music are not true indie rockers, I bet the only indie album they've ever heard is In The Aeroplane Over The Sea. [SEP] Pffft, you know they just listen to Bat for Lashes and My Bloody Valentine 'cause their boyfriends made them listen.",1
"Girl with Down Syndrome loses weight to become model. ||| at least it's more confusing than literally a blowjob [SEP] Wait... Now I am confused, did I miss something?",0
"Why Ryze is Both Underpowered and Broken, and How it Can be fixed. ||| I'm the original writer of this post (the poster had permission, I've tried to stay away from getting sucked into reddit until now), and will try to respond to any questions. [SEP] ryze should make a small jump in the diretion of you cursor after every spell",1
"Picture of an man that was imprisoned for 40 years after being told by the judge he was innocent. ||| And that right there is why the death penalty is morally bankrupt...... ||| Disagree, some crimes are so heinous the only justice is death. [SEP] Yeah and you get the wrong guy, no big deal right?",1
TJ Dillashaw is really embracing the meme. ||| And thats how you go from being a Tyron Woodley into being a liked person [SEP] Tyrone should just embrace the whole race baiter thing?,0
"TIL that Lubbock, Texas has been ranked as the most boring city in the United States (100,000 inhabitants or more), partially due to its poor art, food and music scenes ||| Also partially for it being 3 hours from anywhere else. [SEP] Odessa isn't that far away and is super fun!",1
Tier 12 Gear ||| destiny item manager and tower ghost (both for chrome) are what i use on my laptop on my phone i use ishtar commander ||| They show tier twelve gear? [SEP] No he told you them because they only show T1,1
"What small thing is worth smiling about today? ||| If only the 18-25 votes were counted, Hillary would have won 502 electoral votes. [SEP] So you're telling me the real cause for this is because those people 18 to 25 years ago didn't get busy enough?",1
"TIL during World War II, President Dwight D. Einsenhower predicted that people would try to deny the holocaust ever happened, and therefore ordered people to take as much photographs of the Nazi crimes as possible in order to avoid such attempts. ||| The holocaust was an awful awful thing, but I am getting rather sick of hearing about it. [SEP] Wow I'm so sorry you have to go through that, must be really terrible.",0
Prejudice on a plate: Another restaurant worker in the US gets homophobic abuse in lieu of a tip ||| It's really disturbing how this is starting to happen more frequently after news of the first one spread around. [SEP] Its because more and more Christians are standing up for their rights in face of oppression.,1
"NetCrunch 9 network monitoring overview at 4sysops ||| Can netcrunch pull and save switch config files? ||| No config yet ||| This would be a huge point for us as we use pro curves and haven't found many good config programs for them [SEP] Config management is a major development strategy, so it should be sooner than later",0
"TIL the top speed of the Bugatti Veyron is limited not by the engine, but rather its tires exploding. ||| Most car enthusiasts already know this. ||| not everyone browsing TIL is a car enthusiast [SEP] TIL not everyone is a car enthusiast",1
"Comcast does not have the necessary bandwidth to detect sarcastic remarks ||| Comcast once told me that they had to come out and check my cable lines because they could be dangerous and wanted to charge me money to do it. ||| Comcast once told me my internet connection could be getting disrupted (I was raiding end-game in WoW this past winter, so this was an issue) because the cold weather slowed down the internet. ||| Comcast told me that I should switch from FIOS because the environmental impact of fiber optics is not yet well-understood. [SEP] i wonder how bad light moving down a glass tube really is?",1
Indiana clears Planned Parenthood of wrongdoing after videos ||| Can someone summarize this story? ||| Liberals control the media and are determined to bury this story. [SEP] Good thing you have FOX as the last bastion of American values... right?,1
France is fed up with Trump's 'repeated attacks' to weaken Europe ||| Pretty sure the Brits voted to leave the EU without Trump's endorsement. ||| While remain had Obama's endorment [SEP] Obama would never interfere in an election that's putins job.,1
"Sarah Palin Endorses Donald Trump, Rallying Conservatives. ||| Between this, and the Governor saying ""anyone but Cruz"", I think Trump has Iowa wrapped up. [SEP] Ted Cruz's very bad, no good, rotten day.",0
"TIL Mattel made a handicap Barbie, but was discontinued due to ongoing design problems, such as not being able to roll through the Dream House door in her wheelchair, and her hair getting caught in the wheels ||| ....they couldn't just build a dream house with a bigger doorway and shorten her hair? ||| Too much money, just like real disabled people... :( [SEP] In a dark way, getting rid of disabled people is a much cheaper solution to quite a few zoning issues... So yay Mattel?",1
"Asleep on a Plane ||| Engineers would know the window has a pulldown shade. ||| Isn't that the joke? [SEP] No, because any joke at the expense of women is sexist",1
"Louis CK's daughter ||| If i'm not mistaken, I think that joke was told on his show at one point. ||| Well, he said she didn't steal it, not that he didn't then steal it. [SEP] If parents aren't allowed to steal good jokes from their kids, I don't know what family is",1
"LPT: Keep an extra pair of shoes in your car Especially useful if you need to change a tire and you're wearing new leather shoes. ||| Especially a blanket during these cold months, so your girlfriend can stay warm while you change the tire. [SEP] Thought this would say so you can stay warm while your girlfriend changes the tire",0
"What is something people do that makes you question their intelligence, no matter what evidence you have to the contrary? ||| Taking rumors and stories from chain-forwarded e-mails seriously. [SEP] Are you trying to suggest that Barack HUSSEIN Obama is *not* a Muslim antichrist sleeper agent?",0
Jewish student caught painting Swastikas on her own door then claiming Anti-Semitic Attack - ||| She should be expelled and then executed. ||| No anti semitism here. [SEP] Clearly this guy is just strongly against anti-Semites.,1
"Ted Cruz to star in government shutdown, the sequel. ||| If Republicans shut down the government again, hopefully people won't be so quick to forget it like they did in the 2014 mid-terms. [SEP] You know they'll be looking for, or be ready to manufacture, anything to distract the populace with.",0
Aguero 2-4 ManC vs ManU ||| His 100th goal! ||| Fastest player in Manchester City's history to reach his 100th. [SEP] City and history - doesnt add up.,1
"Watch Dogs runs at 30fps on Xbox One, PS4 ||| So what's the point in buying the new consoles if they can't deliver 1080p @ 60fps like my computer can? ||| well your video card probably cost about the same as a ps4, so theres that ||| Actually ps4 GPU is similar to GTX660, which costs only about $215 [SEP] its actually closer to a 7850 which is cheaper.",1
"Thrusting vigorously in and out until completion ||| Well he went in forward, should have come out forward. [SEP] I bet its a one way and they didn't wanna break any rules",1
"""I am not your average 15 year old"". ||| ""I am far more annoying and pretentious."" ||| And being more annoying and pretentious than *a 15 year old* takes real assholery. [SEP] I am 15 year old and I am not annoying nor pretentious but that's why I'm not your average 15 year old",1
"Obama hijacks Dallas memorial about gun control and racism. ||| About what I'd expect from the Gun Grabber and Race Baiter in Chief [SEP] Yeah, look at all those guns he's grabbed in the past 7 years!",1
"Republicans Plan to Roll Back Parts of the Landmark Endangered Species Act ||| They really are on the exact wrong side of every issue. [SEP] Shh, don't you know, they're both the same!",1
"'Stranger Things' Is A Streaming Hit: Netflix Series Is More Popular Than 'Daredevil' And 'Making A Murderer' ||| Netflix having hit after hit is spelling doom for the cable companies [SEP] With only three seasons, I say they've certainly already killed the Network superhero shows in terms of acclaim and quality.",0
"People revving your engines at 8am on a Saturday...whatcha doin'? ||| I revved up the lawn mower early to cut the grass before it got too hot outside (almost 100 degrees today for the high). [SEP] See if there's a legitimate reason... I'll be annoyed, but I get it.",0
Escher really stepped in it this time. ||| As a former Ironworker that set many many many steel columns and beams as depicted... these bolt patterns give me cancer. [SEP] As a crane operator I too feel your pain,0
"Relevant history - April 18, 2010 Sharks lose 0-1, go down in series 2-1 - rally to defeat Colorado in 6 ||| Bold prediction for tonight: Sharks score at least 1 goal against Talbot. [SEP] Im going for the Sharks come out pissed score 4 and Talbot gets pulled",0
Florida Man tries to hide from police by pretending to be a turtle spotter ||| Floridaman (girlfriend) not pressing charges for stealing her car after reporting it stolen to the police and telling them it was her boyfriend who stole it. [SEP] There's so much going on in this story.,0
"'Plan A Protest, Lose Your House' Bill, SB 1142, Killed by Arizona House ||| This is why I love it when people try to claim the left and Dems are facist freedom haters. [SEP] But protesters are lazy parasites that mooch off the government",1
"Close range defense of our fort as the enemy storm the walls ||| Way to hold a gun properly. ||| It's an airsoft rifle, relax Rambo. [SEP] It honestly looks like he's going to drop the rifle pretty easily.",0
"MFW I accidentally quote an AskReddit thread at a party and my friend's brother recognizes it. ||| If I see ""doing the lord's work"" one more time in a thread where someone outs a female redditor and then goes through her entire profile looking for pics, I think I may scream. [SEP] Don't you know that even in an anonymous internet forum the most important thing about a female is how they look?",1
"Sony Z Ultra Google Play Edition! ||| Looks Great but I love my Nexus 5 :D ||| Hell yeah, with a custom kernel I can squeeze 6hrs screen on time out of mine [SEP] Which custom kernel are you using",0
Barack Obama had a big part in 9/11. ||| Guaranteed that this guy will drown in a cup 'o noodles before he gets his GED. [SEP] He wouldn't eat your crazy foreign noodles to begin with.,0
"New massacre by colitation on Raqqah in Tabqah leave 30 civilians killed along with children, used Apache and drones, NSFW ||| what baffles me is how stupid must the colitation generals be to do this, they don't realize that with the 30 civilians killed today, they just created 300 IS soldiers. [SEP] what baffles me is that you constantly try to spread misinformation, yet still fail horribly.",0
"Half of British Muslims 'think homosexuality should be illegal' ||| I honestly thought it would be higher than half of all Muslims in the UK. [SEP] A lot of people polled are not really religious (go to church/temple/mosque/whatever less than five times a year), but still identify as a certain religion.",0
Pastor presents Trump with prayer shawl during church visit ||| It's my limited understanding from 1 Corinthians that women use prayer shawls to cover their hair while praying. [SEP] So that pastor just made Trump his bitch?,1
"After predictions they'd be terrible, Devils are off to a surprisingly hot start ||| cue some analyst saying it's only fleeting and the Devils ""can't keep it up for long"" ||| Then immediately after praise the Rangers and their Queen. ||| To be fair, they are in first place and Hank has a .945 save pct. [SEP] I actulally met hank, he was a good dude, i was hoping he would be an asshole so it would be easy to hate him",0
"Donald Trump Says More Guns at Orlando Nightclub Would Have Prevented Mass Shooting ||| guns in an club with alcohol sounds like a great idea! [SEP] 50 people shooting in a dark, packed club while drinking would have made this a much better situation.",1
"red riding hood buff ||| I gotta admit this buff is like.. massive.. I wish that'd happen with all of the fairy tale girls, but probably won't though. ||| Sleeping Beauty definitely needs it now that we've got one cross heart lead for every color but Dark. [SEP] Yeah, Dark has been the poverty color so long, Wheres the love?",1
"Bernie Sanders said this, lets upvote to remind him everytime he googles himself. ||| Obama : ""Hillary Clinton not qualified to be POTUS"" **Bernie : ""Hillary Clinton Not Qualified to be POTUS""** #TRUMP: ""CLINTON NOT QUALIFIED TO BE POTUS"" The tribunal has spoken [SEP] Now we just need to find/meme video of Clinton saying she's not qualified either.",0
"Pope Francis backs gay marriage protests in Mexico ||| Call me when Pope Francis does something about child abuse. [SEP] It's not easy finding a solution to keep the snitching brats quiet, give him a break.",0
"So I ordered a rug from IKEA. ||| I like how your ""rug"" is only slightly larger than you scissors [SEP] These extra large scissors are getting out of hand",0
Gucci Mane Encourages All Young Americans To Go Out & Vote ||| Make America Wop Again ||| Gucci vs Kanye 2020 [SEP] Insinuating Kanye isn't just going to win because he's God,1
"Dunkey - Worst Hanzo Ever ||| I feel like he's trying to tell us something. ||| When you edit your kills together you can make it look like you're good ||| Dunkey is actually pretty decent tho. ||| only because he's black, that's why I don't watch his videos no more. ||| If you watched his 500k face reveal you would know that hes actually of Puerto Rican descent [SEP] so he is black and mexican",1
A man makes up to $300 dollars a day by panning for gold and rare gems found on the streets of New York City. ||| Up to $300 a day... Not worth crawling around on the ground all day for me. [SEP] I'd much rather sit in a chair in room with stale air all day than being outside!,1
"Request to change the name of Tar Creeper to Tar Rager What the title says. ||| It's called creeper because it's powercreeping on Am'Gam Rager and Silverback Patriarch [SEP] I'd do the whole ""it's not powercreep if the cards it's replacing never saw any play"" thing but I do it way too often",0
"""Wonder if that animal call worked..."" ||| I love how they both get scared ||| Predators don't work well together. [SEP] That must be why humans get along so poorly with cats and dogs.",1
They're becoming more aware! ||| Cool that they can find the page but not the rules. ||| I did love the selective screenshotting; it's like a malicious attempt to present us in the worst possible light for the purposes of a circlejerk. [SEP] I'm SHOCKED that a SJW would ever do such a thing,1
The Orwells - Terrible Human Beings ||| The Orwells are easily one of the worst things to happen to rock music in the past few years. ||| says the person who is hyped on Lorde and Vampire Weekend. [SEP] Lorde and Vampire Weekend are the best things to happen to rock music in the past few years.,1
"NASCAR looking at track-specific aero packages for 2016 - Aero changes possible *this* year too. ||| I don't care what they do, as long as they suit the cars to Jeff's driving style lol. [SEP] 2016 might be a little late for that.",0
"excited for my first ripper demon task ||| skipper demons ||| All elite slayer mobs are just aids and bullshit and jagex refuses to do anything about them. [SEP] ""but they're elite and not supposedly to be easy""",1
"Ballet Lessons ||| wheres freddy He should be stumbling with one leg in the air ||| I think this is for ladies only, so Funtime Freddy wasn't invited. ||| did you just assume his gender [SEP] you just called him a him",1
"Which videos ruined the image of a famous person? ||| Kanye West interrupting Taylor Swift at the music awards really made him look more of a douchebag [SEP] Oh yeah, that was definitely the beginning of his downfall.",1
Stahp! ||| Stop blowing me Bitch! ||| Those words have never been said by man. [SEP] THAT'S HETERONORMATIVE AND RAPE IGNORANT BEHAVIOR!,1
"TIL DeLorean is Returning In 2013 As An Electric Vehicle ||| Great scott ||| This is heavy! [SEP] Actually, the new DeLorean is supposed to be quite light!",1
"It's been 72 hours, do you know where your black friends are? ||| I'm so tired of race baiting pieces of shit. [SEP] I find that if I don't go on the internet I don't encounter them",0
"""The best minds of my generation..."" Jeff Hammerbacher ||| Sounds a lot like PayPal co-founder Peter Thiel's lament that the best and the brightest college students are ending up in investment banking and consulting instead of creating new value. [SEP] Except for the part where investment banking and consulting are actually important roles that do help to create new value.",0
"Hello friends that do not cannon velds, oh look whats that in my inv an ancient shard wow doing velds down here is good ||| Wow I will definitely do my tasks without a cannon in here from now on thank you scott ||| No problem friend did you also know its better xp/hr as you wont get crashed by those pesky cannoners and the bloodvelds have better alchable drops? [SEP] reverse psychology not working, still going to non cannon bloodvelds in nieves cave",1
"CS:GO Sound Engine ""Bug"" ||| we can only hope that Source2 will fix this ( ._.) ||| CS:GO is also getting ported? ||| Not confirmed but it's all we can hope really [SEP] Dota obviously needs Source 2 more.",1
Exhibutt ||| ... is there a joke I'm missing? ||| The joke is that people will call anything art [SEP] Haha what a unique and modern statement,1
"More saltiness than salt in fast food ||| Yeah dude, western women are a pretty oppressed demographic. [SEP] According to the latest Tumblr studies manspreading is up 35% under the Trump presidency and mansplaining has more than doubled.",0
"Emerson Polls Show Razor Thin Race Between Trump, Clinton in PA, Statistical Tie in NH ||| DONT TRUST THE POLLS GET OUT AND VOTE! [SEP] I already voted for Trump in Florida...and wrote him in for senate over Marco",0
"Today I made a weight bearing arch out of toilet paper rolls ||| Look at Mr rich guy with 20 rolls of toilet paper. ||| As a venezuelan, I haven't seen that much toilet paper together, in like 3 years. [SEP] If someone sent you a large shipment would your life be in danger because of the value?",0
Comments inside a hexdump of malware used to take down a nuclear reactor ||| I especially like the C source code embedded in the compiled program [SEP] The C code was just in a string!,1
"Every Month This Year Has Been the Hottest in Recorded History ||| Meanwhile, the retards in the republican party continue to deny climate change, ignoring the mountains of evidence. [SEP] To be fair, most of the democrats acknowledge climate change but just want to kick the can down the road with some slight regulatory tweaks.",0
"Obama loves pretty boy flamers but won't respect our troops! ||| I'm out of the loop on this, what did really happen? ||| Republicans cut veterans benefits and successfully convinced conservative Americans that Obama did it. ||| And what about the gay football player? [SEP] There was some American football player that got real big and openly came out as gay, because you know that's not commendable and brave at all considering the environment that the sports world exists in.",1
"Much to the displeasure of the wider EU, the Dutch want to liberalize their copyright laws to explicitly allow remixes and mashups. ||| I'm sure the US will issues statements that summarize to ""If you don't play nice, you can't play in my sandbox."" ||| Wow, half of Holland is gonna get extradited like Richard O'Dyer. [SEP] No need for that the US already has the Hague Invasion Act on the books, slight rewording and all is well in your new Abu Hague.",1
"I decided to remote into my home computer, my eight-year-old son was on so I figured I would mess with him. ||| How to actually be in the matrix on windows XP: Press Windows Key + R Type in cmd.exe and press enter type in color 02 in the new console window and press enter then press alt+enter [SEP] Color 07 to go back to B+W, by the way.",0
"Guy tricks girls into kissing him through hilarious ""notebook"" prank ||| let me guess - he slept with the girl in the flowery dress ||| fuck yeah [SEP] One of the few times I've seen this account make a comment that is positive karma",0
"If I die in the same hospital as I was born in the average velocity of my life would be 0 That's a pretty depressing vector ||| Our solar system is still hurtling around the the milky way ||| The OP probably meant the average velocity relative to the earth. [SEP] Live long enough and the tectonic plates will have moved, albeit not far enough to make a difference in comparison to the size of a hospital building.",0
"The worlds tallest building the Burj Khalifa in Dubai lights up in black, yellow and red to show solidarity with Belgium amid terror attacks. ||| Maybe they should take more refugees and stop funding the Syrian War instead of lighting up a skyscraper. [SEP] Hey man they did offer to build 200 mosques in europe after previous terrorist attack thats something",1
"Provocateur Milo Yiannopoulos Gets All-Clear To Appear On Berkeley Campus ||| He better checks his bullet proof chest and makes sure his life insurance premium is not past due. [SEP] Ah yes, hoping that people get killed for simply speaking, that sure sounds like American values to me.",1
"Govt request to remove political content worrying, says Google ||| So those elected by the public, to serve the public, don't want the public to know what they're up to? [SEP] If you ask me Google should get an ""insider"" that incidentally ""betrays"" them and leaks the requests to a secure source.",0
"IQ 160 Wants To Know Which Overwatch Character To Play ||| Shouldn't someone that smart be able to figure it out for himself? [SEP] Its rhetorical, he just broadcasts his inner monologue to provide intellectual depth to the forums from which other players may learn.",1
"Steam, please let Australians use AUD (dollarydoos) already, at this point it's just being misleading! ||| why is it 80$ to begin with ? [SEP] It's expensive to ship to Australia because it's so far away.",1
"What are some ""no homo"" things that shouldn't be so taboo? ||| Using roll on doederant or sitting down to piss. [SEP] TIL I forgot to say *no homo* for years when using a roll on.",1
"Harriet Tubman Wins Poll for Woman on $20 Bill ||| this would be an upgrade because i no idea who is on the 20 right now ||| The guy who murdered a lot of native americans [SEP] He also destroyed the US's central bank, which if you know much about economics should really be considered treason.",0
"Wade falls & knees Paul George to the back of the head ||| Please tell me people don't actually think this was a dirty play just because it was Wade. [SEP] If you look closely, you can see Wade saying ""Fuck your head""",1
"Luke Skywalker featured on a banner promoting Star Wars The Force Awakens ||| All the good guys are facing one way, and Kylo the other, nice. [SEP] But Finn is on the same side and pointing his lightsaber the same way as Kylo!",0
"Oumar Niasse included in Everton's Premier League squad ||| Let's give the lad a chance we pay him 55k a week may as well use him, he can't be worse than Kone in the long run ||| Where did you get 55k a week? ||| Someone posted wages a month or so ago on here his was around 55 and Kone 45ish ||| Someone reliable? [SEP] They seemed realistic figures from what I can remember",0
"What stereotypes, good or bad, hold true to certain cars? ||| Small women in big pickups are a recipe for disaster. [SEP] They always have the seat set in a position where they have to peer through the steering wheel and can't possibly see what's directly in front of them.",0
"NY ranks ""least free"" state in the country ||| Based on a libertarian think tank's definition of ""free"". [SEP] owned by the good ol' Charles Koch foundation",1
"YouTube now supports GLORIOUS 4k @ 60FPS ||| Oh good, I can't wait to pretend I can see the difference on my bargain bin 1080p monitor. [SEP] I can't wait to play those 4k vids on my Xbox",1
"Nationals have a significant interest in Chapman ||| Oh man, Bryce just had a chill go down his spine. [SEP] Bryce is going to have to start bringing a gun and a rape whistle to work with both Papelbom and Chapman in the dugout.",0
"Two-year-olds in Mumbai are taking coaching to clear nursery admissions ||| We are destroying the youth of our country [SEP] saw an amazing cartoon once, with a child labourer weighed down by a pan full of bricks passing a schoolkid weighed down by a bag full of books",0
"Teatro Zinzanni property sold; future uncertain ||| Oh no, where else can I go to get wedding buffet quality food at premium prices? ||| Right on schedule, another PoS smug (likely transplant) asshole. [SEP] Wow, did you just ASSUME the poster's place of origin?",1
